No.     Time           Source                Destination           Protocol Length Info
      1 0.000000       172.18.171.162        8.8.8.8               DNS      71     Standard query 0x0000 A 0-foz5ql-666.wireshark.in

Frame 1: 71 bytes on wire (568 bits), 71 bytes captured (568 bits)
Internet Protocol Version 4, Src: 172.18.171.162, Dst: 8.8.8.8
User Datagram Protocol, Src Port: 7926, Dst Port: 53
Domain Name System (query)

No.     Time           Source                Destination           Protocol Length Info
      2 0.389309       10.217.51.109         8.8.8.8               DNS      70     Standard query 0x0000 A 3dabc211da2.wireshark.in

Frame 2: 70 bytes on wire (560 bits), 70 bytes captured (560 bits)
Internet Protocol Version 4, Src: 10.217.51.109, Dst: 8.8.8.8
User Datagram Protocol, Src Port: 21008, Dst Port: 53
Domain Name System (query)

No.     Time           Source                Destination           Protocol Length Info
      3 0.768052       172.17.241.186        8.8.8.8               DNS      68     Standard query 0x0000 A bc13a2123.wireshark.in

Frame 3: 68 bytes on wire (544 bits), 68 bytes captured (544 bits)
Internet Protocol Version 4, Src: 172.17.241.186, Dst: 8.8.8.8
User Datagram Protocol, Src Port: 20634, Dst Port: 53
Domain Name System (query)

No.     Time           Source                Destination           Protocol Length Info
      4 0.904579       192.168.254.113       8.8.8.8               DNS      77     Standard query 0x0000 A bcccc34124ad2aabdb.wireshark.in

Frame 4: 77 bytes on wire (616 bits), 77 bytes captured (616 bits)
Internet Protocol Version 4, Src: 192.168.254.113, Dst: 8.8.8.8
User Datagram Protocol, Src Port: 43501, Dst Port: 53
Domain Name System (query)

No.     Time           Source                Destination           Protocol Length Info
      5 1.062696       192.168.161.130       8.8.8.8               DNS      79     Standard query 0x0000 A b2aadbd332c2a11c23cd.wireshark.in

Frame 5: 79 bytes on wire (632 bits), 79 bytes captured (632 bits)
Internet Protocol Version 4, Src: 192.168.161.130, Dst: 8.8.8.8
User Datagram Protocol, Src Port: 27014, Dst Port: 53
Domain Name System (query)

No.     Time           Source                Destination           Protocol Length Info
      6 1.400365       10.84.81.167          8.8.8.8               DNS      72     Standard query 0x0000 A 24a3c21b3ccb3.wireshark.in

Frame 6: 72 bytes on wire (576 bits), 72 bytes captured (576 bits)
Internet Protocol Version 4, Src: 10.84.81.167, Dst: 8.8.8.8
User Datagram Protocol, Src Port: 14500, Dst Port: 53
Domain Name System (query)

No.     Time           Source                Destination           Protocol Length Info
      7 1.545458       172.17.129.74         117.171.103.219       HTTP     113    GET /index.html HTTP/1.1 

Frame 7: 113 bytes on wire (904 bits), 113 bytes captured (904 bits)
Internet Protocol Version 4, Src: 172.17.129.74, Dst: 117.171.103.219
Transmission Control Protocol, Src Port: 39603, Dst Port: 80, Seq: 1, Ack: 1, Len: 73
Hypertext Transfer Protocol

No.     Time           Source                Destination           Protocol Length Info
      8 1.621519       192.168.101.148       8.8.8.8               DNS      71     Standard query 0x0000 A 1-xanjyy-927.wireshark.in

Frame 8: 71 bytes on wire (568 bits), 71 bytes captured (568 bits)
Internet Protocol Version 4, Src: 192.168.101.148, Dst: 8.8.8.8
User Datagram Protocol, Src Port: 1295, Dst Port: 53
Domain Name System (query)

No.     Time           Source                Destination           Protocol Length Info
      9 1.801927       10.221.60.37          8.8.8.8               DNS      71     Standard query 0x0000 A 2-zuijbw-777.wireshark.in

Frame 9: 71 bytes on wire (568 bits), 71 bytes captured (568 bits)
Internet Protocol Version 4, Src: 10.221.60.37, Dst: 8.8.8.8
User Datagram Protocol, Src Port: 15730, Dst Port: 53
Domain Name System (query)

No.     Time           Source                Destination           Protocol Length Info
     10 2.152207       192.168.191.43        8.8.8.8               DNS      70     Standard query 0x0000 A 3bd111addbc.wireshark.in

Frame 10: 70 bytes on wire (560 bits), 70 bytes captured (560 bits)
Internet Protocol Version 4, Src: 192.168.191.43, Dst: 8.8.8.8
User Datagram Protocol, Src Port: 32955, Dst Port: 53
Domain Name System (query)

No.     Time           Source                Destination           Protocol Length Info
     11 2.328242       192.168.191.160       8.8.8.8               DNS      71     Standard query 0x0000 A 3-d9l2e0-7?6.wireshark.in

Frame 11: 71 bytes on wire (568 bits), 71 bytes captured (568 bits)
Internet Protocol Version 4, Src: 192.168.191.160, Dst: 8.8.8.8
User Datagram Protocol, Src Port: 9357, Dst Port: 53
Domain Name System (query)

No.     Time           Source                Destination           Protocol Length Info
     12 2.527316       10.102.81.40          8.8.8.8               DNS      71     Standard query 0x0000 A 4-bi527w-6??.wireshark.in

Frame 12: 71 bytes on wire (568 bits), 71 bytes captured (568 bits)
Internet Protocol Version 4, Src: 10.102.81.40, Dst: 8.8.8.8
User Datagram Protocol, Src Port: 2238, Dst Port: 53
Domain Name System (query)

No.     Time           Source                Destination           Protocol Length Info
     13 2.869965       172.21.38.144         221.252.182.105       HTTP     103    GET / HTTP/1.1 

Frame 13: 103 bytes on wire (824 bits), 103 bytes captured (824 bits)
Internet Protocol Version 4, Src: 172.21.38.144, Dst: 221.252.182.105
Transmission Control Protocol, Src Port: 21465, Dst Port: 80, Seq: 1, Ack: 1, Len: 63
Hypertext Transfer Protocol

No.     Time           Source                Destination           Protocol Length Info
     14 3.066141       172.20.139.197        199.23.203.94         HTTP     116    GET /search?q=test HTTP/1.1 

Frame 14: 116 bytes on wire (928 bits), 116 bytes captured (928 bits)
Internet Protocol Version 4, Src: 172.20.139.197, Dst: 199.23.203.94
Transmission Control Protocol, Src Port: 45608, Dst Port: 80, Seq: 1, Ack: 1, Len: 76
Hypertext Transfer Protocol

No.     Time           Source                Destination           Protocol Length Info
     15 3.093855       10.233.224.96         8.8.8.8               DNS      77     Standard query 0x0000 A 2c1ba243adcc321324.wireshark.in

Frame 15: 77 bytes on wire (616 bits), 77 bytes captured (616 bits)
Internet Protocol Version 4, Src: 10.233.224.96, Dst: 8.8.8.8
User Datagram Protocol, Src Port: 56378, Dst Port: 53
Domain Name System (query)

No.     Time           Source                Destination           Protocol Length Info
     16 3.258136       10.25.63.249          163.215.123.156       ICMP     39     Echo (ping) request  id=0x0000, seq=0/0, ttl=64 (no response found!)

Frame 16: 39 bytes on wire (312 bits), 39 bytes captured (312 bits)
Internet Protocol Version 4, Src: 10.25.63.249, Dst: 163.215.123.156
Internet Control Message Protocol

No.     Time           Source                Destination           Protocol Length Info
     17 3.937419       172.29.73.55          190.11.158.144        ICMP     39     Echo (ping) request  id=0x0000, seq=0/0, ttl=64 (no response found!)

Frame 17: 39 bytes on wire (312 bits), 39 bytes captured (312 bits)
Internet Protocol Version 4, Src: 172.29.73.55, Dst: 190.11.158.144
Internet Control Message Protocol

No.     Time           Source                Destination           Protocol Length Info
     18 4.278447       192.168.189.57        8.8.8.8               DNS      67     Standard query 0x0000 A 13c23bba.wireshark.in

Frame 18: 67 bytes on wire (536 bits), 67 bytes captured (536 bits)
Internet Protocol Version 4, Src: 192.168.189.57, Dst: 8.8.8.8
User Datagram Protocol, Src Port: 29391, Dst Port: 53
Domain Name System (query)

No.     Time           Source                Destination           Protocol Length Info
     19 4.739143       172.16.23.198         8.8.8.8               DNS      65     Standard query 0x0000 A 3db3b4.wireshark.in

Frame 19: 65 bytes on wire (520 bits), 65 bytes captured (520 bits)
Internet Protocol Version 4, Src: 172.16.23.198, Dst: 8.8.8.8
User Datagram Protocol, Src Port: 36264, Dst Port: 53
Domain Name System (query)

No.     Time           Source                Destination           Protocol Length Info
     20 5.174030       192.168.35.128        8.8.8.8               DNS      75     Standard query 0x0000 A 241c31a1213bda1b.wireshark.in

Frame 20: 75 bytes on wire (600 bits), 75 bytes captured (600 bits)
Internet Protocol Version 4, Src: 192.168.35.128, Dst: 8.8.8.8
User Datagram Protocol, Src Port: 42239, Dst Port: 53
Domain Name System (query)

No.     Time           Source                Destination           Protocol Length Info
     21 5.460750       192.168.133.37        211.101.32.187        HTTP     113    GET /index.html HTTP/1.1 

Frame 21: 113 bytes on wire (904 bits), 113 bytes captured (904 bits)
Internet Protocol Version 4, Src: 192.168.133.37, Dst: 211.101.32.187
Transmission Control Protocol, Src Port: 37667, Dst Port: 80, Seq: 1, Ack: 1, Len: 73
Hypertext Transfer Protocol

No.     Time           Source                Destination           Protocol Length Info
     22 5.549172       192.168.188.100       8.8.8.8               DNS      71     Standard query 0x0000 A 5-50d6yu-9?7.wireshark.in

Frame 22: 71 bytes on wire (568 bits), 71 bytes captured (568 bits)
Internet Protocol Version 4, Src: 192.168.188.100, Dst: 8.8.8.8
User Datagram Protocol, Src Port: 25938, Dst Port: 53
Domain Name System (query)

No.     Time           Source                Destination           Protocol Length Info
     23 5.857030       172.28.148.215        8.8.8.8               DNS      71     Standard query 0x0000 A 6-k7ik6e-775.wireshark.in

Frame 23: 71 bytes on wire (568 bits), 71 bytes captured (568 bits)
Internet Protocol Version 4, Src: 172.28.148.215, Dst: 8.8.8.8
User Datagram Protocol, Src Port: 28260, Dst Port: 53
Domain Name System (query)

No.     Time           Source                Destination           Protocol Length Info
     24 6.205955       10.112.170.35         8.8.8.8               DNS      68     Standard query 0x0000 A ababdca44.wireshark.in

Frame 24: 68 bytes on wire (544 bits), 68 bytes captured (544 bits)
Internet Protocol Version 4, Src: 10.112.170.35, Dst: 8.8.8.8
User Datagram Protocol, Src Port: 11988, Dst Port: 53
Domain Name System (query)

No.     Time           Source                Destination           Protocol Length Info
     25 7.070995       192.168.173.26        8.8.8.8               DNS      76     Standard query 0x0000 A 142cd3b4bab32332a.wireshark.in

Frame 25: 76 bytes on wire (608 bits), 76 bytes captured (608 bits)
Internet Protocol Version 4, Src: 192.168.173.26, Dst: 8.8.8.8
User Datagram Protocol, Src Port: 34215, Dst Port: 53
Domain Name System (query)

No.     Time           Source                Destination           Protocol Length Info
     26 7.266075       192.168.239.220       232.148.223.42        ICMP     39     Echo (ping) request  id=0x0000, seq=0/0, ttl=64 (multicast)

Frame 26: 39 bytes on wire (312 bits), 39 bytes captured (312 bits)
Internet Protocol Version 4, Src: 192.168.239.220, Dst: 232.148.223.42
Internet Control Message Protocol

No.     Time           Source                Destination           Protocol Length Info
     27 7.321012       192.168.178.153       204.57.126.45         HTTP     116    GET /search?q=test HTTP/1.1 

Frame 27: 116 bytes on wire (928 bits), 116 bytes captured (928 bits)
Internet Protocol Version 4, Src: 192.168.178.153, Dst: 204.57.126.45
Transmission Control Protocol, Src Port: 63218, Dst Port: 80, Seq: 1, Ack: 1, Len: 76
Hypertext Transfer Protocol

No.     Time           Source                Destination           Protocol Length Info
     28 7.769533       10.11.217.38          122.211.176.241       ICMP     39     Echo (ping) request  id=0x0000, seq=0/0, ttl=64 (no response found!)

Frame 28: 39 bytes on wire (312 bits), 39 bytes captured (312 bits)
Internet Protocol Version 4, Src: 10.11.217.38, Dst: 122.211.176.241
Internet Control Message Protocol

No.     Time           Source                Destination           Protocol Length Info
     29 8.109819       10.109.70.167         38.231.10.199         HTTP     113    GET /index.html HTTP/1.1 

Frame 29: 113 bytes on wire (904 bits), 113 bytes captured (904 bits)
Internet Protocol Version 4, Src: 10.109.70.167, Dst: 38.231.10.199
Transmission Control Protocol, Src Port: 35662, Dst Port: 80, Seq: 1, Ack: 1, Len: 73
Hypertext Transfer Protocol

No.     Time           Source                Destination           Protocol Length Info
     30 8.635797       10.39.9.212           8.8.8.8               DNS      73     Standard query 0x0000 A 11a4d12cc22ada.wireshark.in

Frame 30: 73 bytes on wire (584 bits), 73 bytes captured (584 bits)
Internet Protocol Version 4, Src: 10.39.9.212, Dst: 8.8.8.8
User Datagram Protocol, Src Port: 57089, Dst Port: 53
Domain Name System (query)

No.     Time           Source                Destination           Protocol Length Info
     31 8.739885       192.168.129.129       8.8.8.8               DNS      65     Standard query 0x0000 A 12c42c.wireshark.in

Frame 31: 65 bytes on wire (520 bits), 65 bytes captured (520 bits)
Internet Protocol Version 4, Src: 192.168.129.129, Dst: 8.8.8.8
User Datagram Protocol, Src Port: 50309, Dst Port: 53
Domain Name System (query)

No.     Time           Source                Destination           Protocol Length Info
     32 9.008707       192.168.90.197        8.8.8.8               DNS      71     Standard query 0x0000 A 7-a8xsr2-5?4.wireshark.in

Frame 32: 71 bytes on wire (568 bits), 71 bytes captured (568 bits)
Internet Protocol Version 4, Src: 192.168.90.197, Dst: 8.8.8.8
User Datagram Protocol, Src Port: 7915, Dst Port: 53
Domain Name System (query)

No.     Time           Source                Destination           Protocol Length Info
     33 9.996445       10.127.238.150        189.249.182.172       ICMP     39     Echo (ping) request  id=0x0000, seq=0/0, ttl=64 (no response found!)

Frame 33: 39 bytes on wire (312 bits), 39 bytes captured (312 bits)
Internet Protocol Version 4, Src: 10.127.238.150, Dst: 189.249.182.172
Internet Control Message Protocol

No.     Time           Source                Destination           Protocol Length Info
     34 10.257991      172.20.33.44          20.133.24.166         HTTP     103    GET / HTTP/1.1 

Frame 34: 103 bytes on wire (824 bits), 103 bytes captured (824 bits)
Internet Protocol Version 4, Src: 172.20.33.44, Dst: 20.133.24.166
Transmission Control Protocol, Src Port: 49486, Dst Port: 80, Seq: 1, Ack: 1, Len: 63
Hypertext Transfer Protocol

No.     Time           Source                Destination           Protocol Length Info
     35 10.281880      192.168.226.198       8.8.8.8               DNS      75     Standard query 0x0000 A 2cdc2c2cca1da4d2.wireshark.in

Frame 35: 75 bytes on wire (600 bits), 75 bytes captured (600 bits)
Internet Protocol Version 4, Src: 192.168.226.198, Dst: 8.8.8.8
User Datagram Protocol, Src Port: 37648, Dst Port: 53
Domain Name System (query)

No.     Time           Source                Destination           Protocol Length Info
     36 10.604480      192.168.116.250       8.8.8.8               DNS      69     Standard query 0x0000 A 141d2cccdb.wireshark.in

Frame 36: 69 bytes on wire (552 bits), 69 bytes captured (552 bits)
Internet Protocol Version 4, Src: 192.168.116.250, Dst: 8.8.8.8
User Datagram Protocol, Src Port: 2941, Dst Port: 53
Domain Name System (query)

No.     Time           Source                Destination           Protocol Length Info
     37 10.832403      192.168.63.92         83.3.203.113          ICMP     39     Echo (ping) request  id=0x0000, seq=0/0, ttl=64 (no response found!)

Frame 37: 39 bytes on wire (312 bits), 39 bytes captured (312 bits)
Internet Protocol Version 4, Src: 192.168.63.92, Dst: 83.3.203.113
Internet Control Message Protocol

No.     Time           Source                Destination           Protocol Length Info
     38 11.143838      10.42.250.190         174.104.240.53        HTTP     113    GET /index.html HTTP/1.1 

Frame 38: 113 bytes on wire (904 bits), 113 bytes captured (904 bits)
Internet Protocol Version 4, Src: 10.42.250.190, Dst: 174.104.240.53
Transmission Control Protocol, Src Port: 6162, Dst Port: 80, Seq: 1, Ack: 1, Len: 73
Hypertext Transfer Protocol

No.     Time           Source                Destination           Protocol Length Info
     39 11.324234      10.23.253.33          8.8.8.8               DNS      65     Standard query 0x0000 A 3d1cbd.wireshark.in

Frame 39: 65 bytes on wire (520 bits), 65 bytes captured (520 bits)
Internet Protocol Version 4, Src: 10.23.253.33, Dst: 8.8.8.8
User Datagram Protocol, Src Port: 28045, Dst Port: 53
Domain Name System (query)

No.     Time           Source                Destination           Protocol Length Info
     40 11.331223      10.153.240.245        8.8.8.8               DNS      68     Standard query 0x0000 A 32cccd3a4.wireshark.in

Frame 40: 68 bytes on wire (544 bits), 68 bytes captured (544 bits)
Internet Protocol Version 4, Src: 10.153.240.245, Dst: 8.8.8.8
User Datagram Protocol, Src Port: 38428, Dst Port: 53
Domain Name System (query)

No.     Time           Source                Destination           Protocol Length Info
     41 11.504113      10.61.222.82          8.8.8.8               DNS      71     Standard query 0x0000 A 8-w991dn-446.wireshark.in

Frame 41: 71 bytes on wire (568 bits), 71 bytes captured (568 bits)
Internet Protocol Version 4, Src: 10.61.222.82, Dst: 8.8.8.8
User Datagram Protocol, Src Port: 62225, Dst Port: 53
Domain Name System (query)

No.     Time           Source                Destination           Protocol Length Info
     42 11.682285      10.215.72.136         8.8.8.8               DNS      78     Standard query 0x0000 A 1a2ac3bdbd2a43bd1dd.wireshark.in

Frame 42: 78 bytes on wire (624 bits), 78 bytes captured (624 bits)
Internet Protocol Version 4, Src: 10.215.72.136, Dst: 8.8.8.8
User Datagram Protocol, Src Port: 10677, Dst Port: 53
Domain Name System (query)

No.     Time           Source                Destination           Protocol Length Info
     43 12.142427      192.168.221.204       77.100.9.222          HTTP     113    GET /index.html HTTP/1.1 

Frame 43: 113 bytes on wire (904 bits), 113 bytes captured (904 bits)
Internet Protocol Version 4, Src: 192.168.221.204, Dst: 77.100.9.222
Transmission Control Protocol, Src Port: 4625, Dst Port: 80, Seq: 1, Ack: 1, Len: 73
Hypertext Transfer Protocol

No.     Time           Source                Destination           Protocol Length Info
     44 12.715013      172.16.135.115        167.123.252.251       HTTP     113    GET /index.html HTTP/1.1 

Frame 44: 113 bytes on wire (904 bits), 113 bytes captured (904 bits)
Internet Protocol Version 4, Src: 172.16.135.115, Dst: 167.123.252.251
Transmission Control Protocol, Src Port: 12107, Dst Port: 80, Seq: 1, Ack: 1, Len: 73
Hypertext Transfer Protocol

No.     Time           Source                Destination           Protocol Length Info
     45 12.809835      10.222.145.50         8.8.8.8               DNS      75     Standard query 0x0000 A 1d31acbdddd1ca14.wireshark.in

Frame 45: 75 bytes on wire (600 bits), 75 bytes captured (600 bits)
Internet Protocol Version 4, Src: 10.222.145.50, Dst: 8.8.8.8
User Datagram Protocol, Src Port: 10350, Dst Port: 53
Domain Name System (query)

No.     Time           Source                Destination           Protocol Length Info
     46 13.275391      10.66.168.78          189.18.249.241        HTTP     113    GET /index.html HTTP/1.1 

Frame 46: 113 bytes on wire (904 bits), 113 bytes captured (904 bits)
Internet Protocol Version 4, Src: 10.66.168.78, Dst: 189.18.249.241
Transmission Control Protocol, Src Port: 59765, Dst Port: 80, Seq: 1, Ack: 1, Len: 73
Hypertext Transfer Protocol

No.     Time           Source                Destination           Protocol Length Info
     47 13.505404      192.168.142.240       162.35.156.230        HTTP     103    GET / HTTP/1.1 

Frame 47: 103 bytes on wire (824 bits), 103 bytes captured (824 bits)
Internet Protocol Version 4, Src: 192.168.142.240, Dst: 162.35.156.230
Transmission Control Protocol, Src Port: 26480, Dst Port: 80, Seq: 1, Ack: 1, Len: 63
Hypertext Transfer Protocol

No.     Time           Source                Destination           Protocol Length Info
     48 14.546114      10.43.247.100         8.8.8.8               DNS      69     Standard query 0x0000 A 34d3c12bb1.wireshark.in

Frame 48: 69 bytes on wire (552 bits), 69 bytes captured (552 bits)
Internet Protocol Version 4, Src: 10.43.247.100, Dst: 8.8.8.8
User Datagram Protocol, Src Port: 2723, Dst Port: 53
Domain Name System (query)

No.     Time           Source                Destination           Protocol Length Info
     49 14.691739      10.228.152.211        73.205.182.63         HTTP     113    GET /index.html HTTP/1.1 

Frame 49: 113 bytes on wire (904 bits), 113 bytes captured (904 bits)
Internet Protocol Version 4, Src: 10.228.152.211, Dst: 73.205.182.63
Transmission Control Protocol, Src Port: 51834, Dst Port: 80, Seq: 1, Ack: 1, Len: 73
Hypertext Transfer Protocol

No.     Time           Source                Destination           Protocol Length Info
     50 15.243117      172.25.149.123        8.8.8.8               DNS      68     Standard query 0x0000 A baa31331c.wireshark.in

Frame 50: 68 bytes on wire (544 bits), 68 bytes captured (544 bits)
Internet Protocol Version 4, Src: 172.25.149.123, Dst: 8.8.8.8
User Datagram Protocol, Src Port: 32077, Dst Port: 53
Domain Name System (query)

No.     Time           Source                Destination           Protocol Length Info
     51 15.281253      10.242.120.114        8.8.8.8               DNS      71     Standard query 0x0000 A 9-ctc6xt-6?2.wireshark.in

Frame 51: 71 bytes on wire (568 bits), 71 bytes captured (568 bits)
Internet Protocol Version 4, Src: 10.242.120.114, Dst: 8.8.8.8
User Datagram Protocol, Src Port: 20069, Dst Port: 53
Domain Name System (query)

No.     Time           Source                Destination           Protocol Length Info
     52 15.655308      192.168.54.239        8.8.8.8               DNS      77     Standard query 0x0000 A b244c3aa222c3433cb.wireshark.in

Frame 52: 77 bytes on wire (616 bits), 77 bytes captured (616 bits)
Internet Protocol Version 4, Src: 192.168.54.239, Dst: 8.8.8.8
User Datagram Protocol, Src Port: 13149, Dst Port: 53
Domain Name System (query)

No.     Time           Source                Destination           Protocol Length Info
     53 16.539088      192.168.13.194        8.8.8.8               DNS      70     Standard query 0x0000 A 342ac41a2dc.wireshark.in

Frame 53: 70 bytes on wire (560 bits), 70 bytes captured (560 bits)
Internet Protocol Version 4, Src: 192.168.13.194, Dst: 8.8.8.8
User Datagram Protocol, Src Port: 17020, Dst Port: 53
Domain Name System (query)

No.     Time           Source                Destination           Protocol Length Info
     54 16.716522      10.47.85.173          27.206.40.147         HTTP     103    GET / HTTP/1.1 

Frame 54: 103 bytes on wire (824 bits), 103 bytes captured (824 bits)
Internet Protocol Version 4, Src: 10.47.85.173, Dst: 27.206.40.147
Transmission Control Protocol, Src Port: 32283, Dst Port: 80, Seq: 1, Ack: 1, Len: 63
Hypertext Transfer Protocol

No.     Time           Source                Destination           Protocol Length Info
     55 17.103744      192.168.21.231        8.8.8.8               DNS      74     Standard query 0x0000 A ad213a2b4d41421.wireshark.in

Frame 55: 74 bytes on wire (592 bits), 74 bytes captured (592 bits)
Internet Protocol Version 4, Src: 192.168.21.231, Dst: 8.8.8.8
User Datagram Protocol, Src Port: 48253, Dst Port: 53
Domain Name System (query)

No.     Time           Source                Destination           Protocol Length Info
     56 17.389182      192.168.243.172       91.245.247.52         HTTP     113    GET /index.html HTTP/1.1 

Frame 56: 113 bytes on wire (904 bits), 113 bytes captured (904 bits)
Internet Protocol Version 4, Src: 192.168.243.172, Dst: 91.245.247.52
Transmission Control Protocol, Src Port: 14939, Dst Port: 80, Seq: 1, Ack: 1, Len: 73
Hypertext Transfer Protocol

No.     Time           Source                Destination           Protocol Length Info
     57 17.634471      10.225.20.209         8.8.8.8               DNS      72     Standard query 0x0000 A 10-0mgbr5-277.wireshark.in

Frame 57: 72 bytes on wire (576 bits), 72 bytes captured (576 bits)
Internet Protocol Version 4, Src: 10.225.20.209, Dst: 8.8.8.8
User Datagram Protocol, Src Port: 59216, Dst Port: 53
Domain Name System (query)

No.     Time           Source                Destination           Protocol Length Info
     58 17.752610      10.5.21.51            121.49.205.209        HTTP     103    GET / HTTP/1.1 

Frame 58: 103 bytes on wire (824 bits), 103 bytes captured (824 bits)
Internet Protocol Version 4, Src: 10.5.21.51, Dst: 121.49.205.209
Transmission Control Protocol, Src Port: 51623, Dst Port: 80, Seq: 1, Ack: 1, Len: 63
Hypertext Transfer Protocol

No.     Time           Source                Destination           Protocol Length Info
     59 18.214866      10.138.177.134        54.42.110.42          HTTP     113    GET /index.html HTTP/1.1 

Frame 59: 113 bytes on wire (904 bits), 113 bytes captured (904 bits)
Internet Protocol Version 4, Src: 10.138.177.134, Dst: 54.42.110.42
Transmission Control Protocol, Src Port: 7627, Dst Port: 80, Seq: 1, Ack: 1, Len: 73
Hypertext Transfer Protocol

No.     Time           Source                Destination           Protocol Length Info
     60 18.824618      172.29.78.44          8.8.8.8               DNS      76     Standard query 0x0000 A 14cddb34c3c34bd11.wireshark.in

Frame 60: 76 bytes on wire (608 bits), 76 bytes captured (608 bits)
Internet Protocol Version 4, Src: 172.29.78.44, Dst: 8.8.8.8
User Datagram Protocol, Src Port: 13249, Dst Port: 53
Domain Name System (query)

No.     Time           Source                Destination           Protocol Length Info
     61 19.055465      172.28.104.11         8.8.8.8               DNS      65     Standard query 0x0000 A 4a441b.wireshark.in

Frame 61: 65 bytes on wire (520 bits), 65 bytes captured (520 bits)
Internet Protocol Version 4, Src: 172.28.104.11, Dst: 8.8.8.8
User Datagram Protocol, Src Port: 29207, Dst Port: 53
Domain Name System (query)

No.     Time           Source                Destination           Protocol Length Info
     62 19.144615      192.168.91.128        8.8.8.8               DNS      71     Standard query 0x0000 A 1bda224d12db.wireshark.in

Frame 62: 71 bytes on wire (568 bits), 71 bytes captured (568 bits)
Internet Protocol Version 4, Src: 192.168.91.128, Dst: 8.8.8.8
User Datagram Protocol, Src Port: 38770, Dst Port: 53
Domain Name System (query)

No.     Time           Source                Destination           Protocol Length Info
     63 19.300861      192.168.213.119       8.8.8.8               DNS      76     Standard query 0x0000 A 34a42cacb4c3bd4ad.wireshark.in

Frame 63: 76 bytes on wire (608 bits), 76 bytes captured (608 bits)
Internet Protocol Version 4, Src: 192.168.213.119, Dst: 8.8.8.8
User Datagram Protocol, Src Port: 20547, Dst Port: 53
Domain Name System (query)

No.     Time           Source                Destination           Protocol Length Info
     64 19.813690      10.111.245.20         8.8.8.8               DNS      75     Standard query 0x0000 A ddb2dac22b2baadb.wireshark.in

Frame 64: 75 bytes on wire (600 bits), 75 bytes captured (600 bits)
Internet Protocol Version 4, Src: 10.111.245.20, Dst: 8.8.8.8
User Datagram Protocol, Src Port: 42937, Dst Port: 53
Domain Name System (query)

No.     Time           Source                Destination           Protocol Length Info
     65 19.913854      10.30.227.192         8.8.8.8               DNS      72     Standard query 0x0000 A 11-ad2hto-744.wireshark.in

Frame 65: 72 bytes on wire (576 bits), 72 bytes captured (576 bits)
Internet Protocol Version 4, Src: 10.30.227.192, Dst: 8.8.8.8
User Datagram Protocol, Src Port: 33584, Dst Port: 53
Domain Name System (query)

No.     Time           Source                Destination           Protocol Length Info
     66 21.019427      172.18.156.9          142.188.244.113       HTTP     113    GET /index.html HTTP/1.1 

Frame 66: 113 bytes on wire (904 bits), 113 bytes captured (904 bits)
Internet Protocol Version 4, Src: 172.18.156.9, Dst: 142.188.244.113
Transmission Control Protocol, Src Port: 19037, Dst Port: 80, Seq: 1, Ack: 1, Len: 73
Hypertext Transfer Protocol

No.     Time           Source                Destination           Protocol Length Info
     67 21.055476      10.12.207.200         149.134.15.58         HTTP     113    GET /index.html HTTP/1.1 

Frame 67: 113 bytes on wire (904 bits), 113 bytes captured (904 bits)
Internet Protocol Version 4, Src: 10.12.207.200, Dst: 149.134.15.58
Transmission Control Protocol, Src Port: 19741, Dst Port: 80, Seq: 1, Ack: 1, Len: 73
Hypertext Transfer Protocol

No.     Time           Source                Destination           Protocol Length Info
     68 21.353779      192.168.51.244        135.166.16.180        HTTP     103    GET / HTTP/1.1 

Frame 68: 103 bytes on wire (824 bits), 103 bytes captured (824 bits)
Internet Protocol Version 4, Src: 192.168.51.244, Dst: 135.166.16.180
Transmission Control Protocol, Src Port: 14140, Dst Port: 80, Seq: 1, Ack: 1, Len: 63
Hypertext Transfer Protocol

No.     Time           Source                Destination           Protocol Length Info
     69 21.382374      10.174.242.120        184.20.91.216         HTTP     113    GET /index.html HTTP/1.1 

Frame 69: 113 bytes on wire (904 bits), 113 bytes captured (904 bits)
Internet Protocol Version 4, Src: 10.174.242.120, Dst: 184.20.91.216
Transmission Control Protocol, Src Port: 42319, Dst Port: 80, Seq: 1, Ack: 1, Len: 73
Hypertext Transfer Protocol

No.     Time           Source                Destination           Protocol Length Info
     70 21.537514      10.174.21.141         8.8.8.8               DNS      67     Standard query 0x0000 A a33d3dab.wireshark.in

Frame 70: 67 bytes on wire (536 bits), 67 bytes captured (536 bits)
Internet Protocol Version 4, Src: 10.174.21.141, Dst: 8.8.8.8
User Datagram Protocol, Src Port: 52330, Dst Port: 53
Domain Name System (query)

No.     Time           Source                Destination           Protocol Length Info
     71 22.130287      172.31.25.99          8.8.8.8               DNS      65     Standard query 0x0000 A abdd23.wireshark.in

Frame 71: 65 bytes on wire (520 bits), 65 bytes captured (520 bits)
Internet Protocol Version 4, Src: 172.31.25.99, Dst: 8.8.8.8
User Datagram Protocol, Src Port: 1554, Dst Port: 53
Domain Name System (query)

No.     Time           Source                Destination           Protocol Length Info
     72 22.207146      10.55.119.135         8.8.8.8               DNS      72     Standard query 0x0000 A 12-g276yw-422.wireshark.in

Frame 72: 72 bytes on wire (576 bits), 72 bytes captured (576 bits)
Internet Protocol Version 4, Src: 10.55.119.135, Dst: 8.8.8.8
User Datagram Protocol, Src Port: 10947, Dst Port: 53
Domain Name System (query)

No.     Time           Source                Destination           Protocol Length Info
     73 22.234727      192.168.86.217        8.8.8.8               DNS      70     Standard query 0x0000 A ba31d32db3a.wireshark.in

Frame 73: 70 bytes on wire (560 bits), 70 bytes captured (560 bits)
Internet Protocol Version 4, Src: 192.168.86.217, Dst: 8.8.8.8
User Datagram Protocol, Src Port: 45392, Dst Port: 53
Domain Name System (query)

No.     Time           Source                Destination           Protocol Length Info
     74 23.227104      10.4.130.181          31.217.112.131        HTTP     116    GET /search?q=test HTTP/1.1 

Frame 74: 116 bytes on wire (928 bits), 116 bytes captured (928 bits)
Internet Protocol Version 4, Src: 10.4.130.181, Dst: 31.217.112.131
Transmission Control Protocol, Src Port: 4926, Dst Port: 80, Seq: 1, Ack: 1, Len: 76
Hypertext Transfer Protocol

No.     Time           Source                Destination           Protocol Length Info
     75 23.346706      10.137.126.186        209.73.39.37          HTTP     113    GET /index.html HTTP/1.1 

Frame 75: 113 bytes on wire (904 bits), 113 bytes captured (904 bits)
Internet Protocol Version 4, Src: 10.137.126.186, Dst: 209.73.39.37
Transmission Control Protocol, Src Port: 1450, Dst Port: 80, Seq: 1, Ack: 1, Len: 73
Hypertext Transfer Protocol

No.     Time           Source                Destination           Protocol Length Info
     76 24.094001      172.31.227.202        8.8.8.8               DNS      78     Standard query 0x0000 A cbdb34bc1b4a33da4a1.wireshark.in

Frame 76: 78 bytes on wire (624 bits), 78 bytes captured (624 bits)
Internet Protocol Version 4, Src: 172.31.227.202, Dst: 8.8.8.8
User Datagram Protocol, Src Port: 41567, Dst Port: 53
Domain Name System (query)

No.     Time           Source                Destination           Protocol Length Info
     77 24.143051      192.168.32.166        248.92.95.193         HTTP     113    GET /index.html HTTP/1.1 

Frame 77: 113 bytes on wire (904 bits), 113 bytes captured (904 bits)
Internet Protocol Version 4, Src: 192.168.32.166, Dst: 248.92.95.193
Transmission Control Protocol, Src Port: 33163, Dst Port: 80, Seq: 1, Ack: 1, Len: 73
Hypertext Transfer Protocol

No.     Time           Source                Destination           Protocol Length Info
     78 24.349542      172.24.155.73         20.146.246.56         HTTP     116    GET /search?q=test HTTP/1.1 

Frame 78: 116 bytes on wire (928 bits), 116 bytes captured (928 bits)
Internet Protocol Version 4, Src: 172.24.155.73, Dst: 20.146.246.56
Transmission Control Protocol, Src Port: 28090, Dst Port: 80, Seq: 1, Ack: 1, Len: 76
Hypertext Transfer Protocol

No.     Time           Source                Destination           Protocol Length Info
     79 24.831973      192.168.85.19         8.8.8.8               DNS      72     Standard query 0x0000 A 13-ezm382-255.wireshark.in

Frame 79: 72 bytes on wire (576 bits), 72 bytes captured (576 bits)
Internet Protocol Version 4, Src: 192.168.85.19, Dst: 8.8.8.8
User Datagram Protocol, Src Port: 18950, Dst Port: 53
Domain Name System (query)

No.     Time           Source                Destination           Protocol Length Info
     80 24.877337      172.28.103.22         8.8.8.8               DNS      73     Standard query 0x0000 A 14ad1d343a1bca.wireshark.in

Frame 80: 73 bytes on wire (584 bits), 73 bytes captured (584 bits)
Internet Protocol Version 4, Src: 172.28.103.22, Dst: 8.8.8.8
User Datagram Protocol, Src Port: 5451, Dst Port: 53
Domain Name System (query)

No.     Time           Source                Destination           Protocol Length Info
     81 25.659501      192.168.231.131       8.8.8.8               DNS      71     Standard query 0x0000 A 2cca2d2aa3bc.wireshark.in

Frame 81: 71 bytes on wire (568 bits), 71 bytes captured (568 bits)
Internet Protocol Version 4, Src: 192.168.231.131, Dst: 8.8.8.8
User Datagram Protocol, Src Port: 36413, Dst Port: 53
Domain Name System (query)

No.     Time           Source                Destination           Protocol Length Info
     82 25.850726      172.20.109.64         8.8.8.8               DNS      76     Standard query 0x0000 A 2b1cab1b2d31dd22d.wireshark.in

Frame 82: 76 bytes on wire (608 bits), 76 bytes captured (608 bits)
Internet Protocol Version 4, Src: 172.20.109.64, Dst: 8.8.8.8
User Datagram Protocol, Src Port: 31322, Dst Port: 53
Domain Name System (query)

No.     Time           Source                Destination           Protocol Length Info
     83 26.135546      172.17.5.218          8.8.8.8               DNS      69     Standard query 0x0000 A b2da3dcbbb.wireshark.in

Frame 83: 69 bytes on wire (552 bits), 69 bytes captured (552 bits)
Internet Protocol Version 4, Src: 172.17.5.218, Dst: 8.8.8.8
User Datagram Protocol, Src Port: 52181, Dst Port: 53
Domain Name System (query)

No.     Time           Source                Destination           Protocol Length Info
     84 26.315256      10.194.211.165        8.8.8.8               DNS      70     Standard query 0x0000 A 14-ypn5v5-?.wireshark.in

Frame 84: 70 bytes on wire (560 bits), 70 bytes captured (560 bits)
Internet Protocol Version 4, Src: 10.194.211.165, Dst: 8.8.8.8
User Datagram Protocol, Src Port: 17090, Dst Port: 53
Domain Name System (query)

No.     Time           Source                Destination           Protocol Length Info
     85 26.672583      172.20.118.33         215.236.32.167        HTTP     103    GET / HTTP/1.1 

Frame 85: 103 bytes on wire (824 bits), 103 bytes captured (824 bits)
Internet Protocol Version 4, Src: 172.20.118.33, Dst: 215.236.32.167
Transmission Control Protocol, Src Port: 57668, Dst Port: 80, Seq: 1, Ack: 1, Len: 63
Hypertext Transfer Protocol

No.     Time           Source                Destination           Protocol Length Info
     86 27.283178      192.168.85.94         240.209.183.56        HTTP     113    GET /index.html HTTP/1.1 

Frame 86: 113 bytes on wire (904 bits), 113 bytes captured (904 bits)
Internet Protocol Version 4, Src: 192.168.85.94, Dst: 240.209.183.56
Transmission Control Protocol, Src Port: 32960, Dst Port: 80, Seq: 1, Ack: 1, Len: 73
Hypertext Transfer Protocol

No.     Time           Source                Destination           Protocol Length Info
     87 27.723756      192.168.13.49         8.8.8.8               DNS      77     Standard query 0x0000 A cdc4b2ddb41a12a1ca.wireshark.in

Frame 87: 77 bytes on wire (616 bits), 77 bytes captured (616 bits)
Internet Protocol Version 4, Src: 192.168.13.49, Dst: 8.8.8.8
User Datagram Protocol, Src Port: 63770, Dst Port: 53
Domain Name System (query)

No.     Time           Source                Destination           Protocol Length Info
     88 27.872482      192.168.206.5         215.225.2.188         HTTP     103    GET / HTTP/1.1 

Frame 88: 103 bytes on wire (824 bits), 103 bytes captured (824 bits)
Internet Protocol Version 4, Src: 192.168.206.5, Dst: 215.225.2.188
Transmission Control Protocol, Src Port: 19063, Dst Port: 80, Seq: 1, Ack: 1, Len: 63
Hypertext Transfer Protocol

No.     Time           Source                Destination           Protocol Length Info
     89 27.973463      10.97.247.17          144.215.148.130       HTTP     116    GET /search?q=test HTTP/1.1 

Frame 89: 116 bytes on wire (928 bits), 116 bytes captured (928 bits)
Internet Protocol Version 4, Src: 10.97.247.17, Dst: 144.215.148.130
Transmission Control Protocol, Src Port: 44511, Dst Port: 80, Seq: 1, Ack: 1, Len: 76
Hypertext Transfer Protocol

No.     Time           Source                Destination           Protocol Length Info
     90 28.018216      192.168.116.120       8.8.8.8               DNS      79     Standard query 0x0000 A 211a2c44d4b24db22ba4.wireshark.in

Frame 90: 79 bytes on wire (632 bits), 79 bytes captured (632 bits)
Internet Protocol Version 4, Src: 192.168.116.120, Dst: 8.8.8.8
User Datagram Protocol, Src Port: 8868, Dst Port: 53
Domain Name System (query)

No.     Time           Source                Destination           Protocol Length Info
     91 28.127091      10.122.147.22         8.8.8.8               DNS      73     Standard query 0x0000 A d34213aab1a22c.wireshark.in

Frame 91: 73 bytes on wire (584 bits), 73 bytes captured (584 bits)
Internet Protocol Version 4, Src: 10.122.147.22, Dst: 8.8.8.8
User Datagram Protocol, Src Port: 52912, Dst Port: 53
Domain Name System (query)

No.     Time           Source                Destination           Protocol Length Info
     92 28.396136      172.31.33.132         8.8.8.8               DNS      66     Standard query 0x0000 A 323c4d1.wireshark.in

Frame 92: 66 bytes on wire (528 bits), 66 bytes captured (528 bits)
Internet Protocol Version 4, Src: 172.31.33.132, Dst: 8.8.8.8
User Datagram Protocol, Src Port: 60597, Dst Port: 53
Domain Name System (query)

No.     Time           Source                Destination           Protocol Length Info
     93 28.558521      192.168.28.78         8.8.8.8               DNS      73     Standard query 0x0000 A cac12dca1342bb.wireshark.in

Frame 93: 73 bytes on wire (584 bits), 73 bytes captured (584 bits)
Internet Protocol Version 4, Src: 192.168.28.78, Dst: 8.8.8.8
User Datagram Protocol, Src Port: 18181, Dst Port: 53
Domain Name System (query)

No.     Time           Source                Destination           Protocol Length Info
     94 28.809200      10.144.115.210        8.8.8.8               DNS      76     Standard query 0x0000 A 3bb1a2b4abcacc2a3.wireshark.in

Frame 94: 76 bytes on wire (608 bits), 76 bytes captured (608 bits)
Internet Protocol Version 4, Src: 10.144.115.210, Dst: 8.8.8.8
User Datagram Protocol, Src Port: 38175, Dst Port: 53
Domain Name System (query)

No.     Time           Source                Destination           Protocol Length Info
     95 29.251160      10.147.29.10          8.8.8.8               DNS      67     Standard query 0x0000 A 4aa2cdbd.wireshark.in

Frame 95: 67 bytes on wire (536 bits), 67 bytes captured (536 bits)
Internet Protocol Version 4, Src: 10.147.29.10, Dst: 8.8.8.8
User Datagram Protocol, Src Port: 14049, Dst Port: 53
Domain Name System (query)

No.     Time           Source                Destination           Protocol Length Info
     96 29.725157      10.237.21.184         8.8.8.8               DNS      66     Standard query 0x0000 A 4db13a3.wireshark.in

Frame 96: 66 bytes on wire (528 bits), 66 bytes captured (528 bits)
Internet Protocol Version 4, Src: 10.237.21.184, Dst: 8.8.8.8
User Datagram Protocol, Src Port: 56113, Dst Port: 53
Domain Name System (query)

No.     Time           Source                Destination           Protocol Length Info
     97 30.138951      172.24.60.128         8.8.8.8               DNS      68     Standard query 0x0000 A aa32c3cdc.wireshark.in

Frame 97: 68 bytes on wire (544 bits), 68 bytes captured (544 bits)
Internet Protocol Version 4, Src: 172.24.60.128, Dst: 8.8.8.8
User Datagram Protocol, Src Port: 64941, Dst Port: 53
Domain Name System (query)

No.     Time           Source                Destination           Protocol Length Info
     98 30.476248      10.27.24.241          8.8.8.8               DNS      72     Standard query 0x0000 A 4c33d44ca2ac3.wireshark.in

Frame 98: 72 bytes on wire (576 bits), 72 bytes captured (576 bits)
Internet Protocol Version 4, Src: 10.27.24.241, Dst: 8.8.8.8
User Datagram Protocol, Src Port: 65403, Dst Port: 53
Domain Name System (query)

No.     Time           Source                Destination           Protocol Length Info
     99 30.842730      192.168.168.94        8.8.8.8               DNS      74     Standard query 0x0000 A b2ab114bdc24a33.wireshark.in

Frame 99: 74 bytes on wire (592 bits), 74 bytes captured (592 bits)
Internet Protocol Version 4, Src: 192.168.168.94, Dst: 8.8.8.8
User Datagram Protocol, Src Port: 58784, Dst Port: 53
Domain Name System (query)
